id,nombre,descripcion,precio,stock,ruta_imagen
101,Laptop Gamer,"Potente laptop para juegos con tarjeta grafica dedicada y procesador de ultima generacion.",1500.00,10,images/laptop_gamer.jpg
102,Mouse Inalambrico,"Mouse ergonomico con alta precision y bateria de larga duracion.",50.00,50,images/mouse_inalambrico.jpg
201,Teclado Mecanico,"Teclado con switches mecanicos para una respuesta tactil y rapida.",120.00,30,images/teclado_mecanico.jpg
301,Monitor 27 pulgadas,"Monitor QHD de 27 pulgadas con colores vibrantes y 144Hz de refresco.",300.00,20,images/monitor_27.jpg
401,Silla de Oficina,"Silla ergonomica con soporte lumbar ajustable y materiales de alta calidad.",950.00,5,images/silla_oficina.jpg
402,Escritorio de pie,"Escritorio ajustable en altura para trabajar de pie o sentado.",600.00,8,images/escritorio_pie.jpg